{
  "$id": "agent-workflow-comparative-eval/decision-study-spec/v1",
  "$schema": "https://json-schema.org/draft/2020-12/schema",
  "type": "object",
  "additionalProperties": true,
  "properties": {
    "schema": {"const": "agent-workflow-comparative-eval/decision-study-spec/v1"},
    "study_id": {"type": "string", "minLength": 1},
    "study_version": {"type": "string", "minLength": 1},
    "status": {"type": "string", "minLength": 1},
    "purpose": {"type": "string", "minLength": 1},
    "evaluation_unit": {"type": "string", "minLength": 1},
    "decision_seams": {"type": "array", "minItems": 1},
    "research_questions": {"type": "array", "minItems": 1},
    "sample_policy": {"type": "object"},
    "oracle_policy": {"type": "object"},
    "exclusion_policy": {"type": "object"},
    "evidence_policy": {"type": "object"},
    "frozen_runtime_identity": {"type": "object"},
    "claim_policy": {"type": "object"}
  },
  "required": ["schema", "study_id", "study_version", "status", "purpose", "evaluation_unit", "decision_seams", "research_questions", "sample_policy", "oracle_policy", "exclusion_policy", "evidence_policy", "frozen_runtime_identity", "claim_policy"]
}
